{
  "$schema": "https://json-schema.org/draft/2020-12/schema",
  "title": "APIMap",
  "description": "Mapa de endpoints HTTP, blueprints y webhooks generado por analyzers/api.py.",
  "type": "object",
  "required": ["framework", "schema_files", "blueprints", "webhooks", "middleware_files"],
  "additionalProperties": false,
  "properties": {
    "framework":    { "type": ["string", "null"] },
    "schema_files": { "type": "array", "items": { "type": "string" } },
    "blueprints": {
      "type": "array",
      "items": {
        "type": "object",
        "required": ["name", "file", "prefix", "test_file", "endpoints"],
        "additionalProperties": false,
        "properties": {
          "name":      { "type": "string" },
          "file":      { "type": "string" },
          "prefix":    { "type": "string" },
          "test_file": { "type": ["string", "null"] },
          "endpoints": {
            "type": "array",
            "items": {
              "type": "object",
              "required": ["function", "line", "methods", "route", "auth_required"],
              "additionalProperties": false,
              "properties": {
                "function":      { "type": "string" },
                "line":          { "type": "integer" },
                "methods":       { "type": "array", "items": { "type": "string" } },
                "route":         { "type": "string" },
                "auth_required": { "type": "boolean" }
              }
            }
          }
        }
      }
    },
    "webhooks": {
      "type": "array",
      "items": {
        "type": "object",
        "required": ["file", "function", "line", "route", "methods"],
        "additionalProperties": false,
        "properties": {
          "file":     { "type": "string" },
          "function": { "type": "string" },
          "line":     { "type": "integer" },
          "route":    { "type": "string" },
          "methods":  { "type": "array", "items": { "type": "string" } }
        }
      }
    },
    "middleware_files": { "type": "array", "items": { "type": "string" } }
  }
}
