{
  "framework": "Flask",
  "schema_files": [
    "schemas/usuario.py",
    "schemas/twilio.py"
  ],
  "blueprints": [
    {
      "name": "main",
      "file": "main.py",
      "prefix": "",
      "test_file": null,
      "endpoints": [
        {
          "function": "health",
          "line": 92,
          "methods": [
            "GET"
          ],
          "route": "/health",
          "auth_required": false
        }
      ]
    },
    {
      "name": "metricas_operacion",
      "file": "blueprints/metricas_operacion.py",
      "prefix": "",
      "test_file": "tests/test_metricas_operacion.py",
      "endpoints": [
        {
          "function": "resumen",
          "line": 22,
          "methods": [
            "GET"
          ],
          "route": "/metricas/operacion/resumen",
          "auth_required": false
        },
        {
          "function": "asistencia",
          "line": 28,
          "methods": [
            "GET"
          ],
          "route": "/metricas/operacion/asistencia",
          "auth_required": false
        },
        {
          "function": "colas",
          "line": 34,
          "methods": [
            "GET"
          ],
          "route": "/metricas/operacion/colas",
          "auth_required": false
        },
        {
          "function": "pedidos_estado",
          "line": 40,
          "methods": [
            "GET"
          ],
          "route": "/metricas/operacion/pedidos-estado",
          "auth_required": false
        },
        {
          "function": "alertas",
          "line": 46,
          "methods": [
            "GET"
          ],
          "route": "/metricas/operacion/alertas",
          "auth_required": false
        }
      ]
    },
    {
      "name": "empleado",
      "file": "blueprints/empleado.py",
      "prefix": "",
      "test_file": "tests/test_empleado.py",
      "endpoints": [
        {
          "function": "index",
          "line": 19,
          "methods": [
            "GET"
          ],
          "route": "/empleado",
          "auth_required": false
        },
        {
          "function": "perfil",
          "line": 33,
          "methods": [
            "GET"
          ],
          "route": "/empleado/perfil",
          "auth_required": false
        },
        {
          "function": "estado",
          "line": 47,
          "methods": [
            "POST"
          ],
          "route": "/empleado/estado",
          "auth_required": false
        },
        {
          "function": "turno_hoy",
          "line": 61,
          "methods": [
            "GET"
          ],
          "route": "/empleado/turno-hoy",
          "auth_required": false
        },
        {
          "function": "metricas",
          "line": 73,
          "methods": [
            "GET"
          ],
          "route": "/empleado/metricas",
          "auth_required": false
        },
        {
          "function": "capacidades",
          "line": 86,
          "methods": [
            "GET"
          ],
          "route": "/empleado/capacidades",
          "auth_required": false
        },
        {
          "function": "carga_operativa",
          "line": 100,
          "methods": [
            "GET"
          ],
          "route": "/empleado/carga-operativa",
          "auth_required": false
        },
        {
          "function": "cambiar_rol",
          "line": 111,
          "methods": [
            "POST"
          ],
          "route": "/empleado/cambiar-rol",
          "auth_required": false
        },
        {
          "function": "checkin",
          "line": 131,
          "methods": [
            "GET"
          ],
          "route": "/empleado/checkin",
          "auth_required": false
        },
        {
          "function": "fichaje_iniciar",
          "line": 151,
          "methods": [
            "POST"
          ],
          "route": "/empleado/fichaje",
          "auth_required": false
        },
        {
          "function": "fichaje_cerrar",
          "line": 168,
          "methods": [
            "POST"
          ],
          "route": "/empleado/fichaje/cerrar",
          "auth_required": false
        },
        {
          "function": "fichaje_hoy",
          "line": 184,
          "methods": [
            "GET"
          ],
          "route": "/empleado/fichaje/hoy",
          "auth_required": false
        }
      ]
    },
    {
      "name": "picker",
      "file": "blueprints/picker.py",
      "prefix": "",
      "test_file": "tests/test_picker_cola.py",
      "endpoints": [
        {
          "function": "index",
          "line": 29,
          "methods": [
            "GET"
          ],
          "route": "/picker",
          "auth_required": false
        },
        {
          "function": "apple_touch_icon",
          "line": 41,
          "methods": [
            "GET"
          ],
          "route": "/favicon.ico",
          "auth_required": false
        },
        {
          "function": "manifest",
          "line": 51,
          "methods": [
            "GET"
          ],
          "route": "/picker/manifest.json",
          "auth_required": false
        },
        {
          "function": "service_worker",
          "line": 60,
          "methods": [
            "GET"
          ],
          "route": "/picker/sw.js",
          "auth_required": false
        },
        {
          "function": "mis_pedidos",
          "line": 72,
          "methods": [
            "GET"
          ],
          "route": "/picker/mis-pedidos",
          "auth_required": false
        },
        {
          "function": "actualizar_item",
          "line": 83,
          "methods": [
            "POST"
          ],
          "route": "/picker/item/<int:item_id>/estado",
          "auth_required": false
        },
        {
          "function": "buscar_productos",
          "line": 112,
          "methods": [
            "GET"
          ],
          "route": "/picker/buscar-productos",
          "auth_required": false
        },
        {
          "function": "finalizar_picking",
          "line": 125,
          "methods": [
            "POST"
          ],
          "route": "/picker/picking/<int:picking_id>/finalizar",
          "auth_required": false
        },
        {
          "function": "cola",
          "line": 135,
          "methods": [
            "GET"
          ],
          "route": "/picker/cola",
          "auth_required": false
        },
        {
          "function": "coger_picking",
          "line": 146,
          "methods": [
            "POST"
          ],
          "route": "/picker/cola/coger/<int:picking_id>",
          "auth_required": false
        }
      ]
    },
    {
      "name": "dashboard",
      "file": "blueprints/dashboard.py",
      "prefix": "",
      "test_file": "tests/test_dashboard_sprint3.py",
      "endpoints": [
        {
          "function": "index",
          "line": 56,
          "methods": [
            "GET"
          ],
          "route": "/dashboard",
          "auth_required": false
        },
        {
          "function": "monitor",
          "line": 62,
          "methods": [
            "GET"
          ],
          "route": "/dashboard/monitor",
          "auth_required": false
        },
        {
          "function": "monitor_datos",
          "line": 68,
          "methods": [
            "GET"
          ],
          "route": "/dashboard/monitor/datos",
          "auth_required": false
        },
        {
          "function": "metricas",
          "line": 92,
          "methods": [
            "GET"
          ],
          "route": "/dashboard/metricas",
          "auth_required": false
        },
        {
          "function": "pedidos_activos",
          "line": 102,
          "methods": [
            "GET"
          ],
          "route": "/dashboard/pedidos-activos",
          "auth_required": false
        },
        {
          "function": "picking",
          "line": 113,
          "methods": [
            "GET"
          ],
          "route": "/dashboard/picking",
          "auth_required": false
        },
        {
          "function": "repartidores",
          "line": 123,
          "methods": [
            "GET"
          ],
          "route": "/dashboard/repartidores",
          "auth_required": false
        },
        {
          "function": "alertas",
          "line": 133,
          "methods": [
            "GET"
          ],
          "route": "/dashboard/alertas",
          "auth_required": false
        },
        {
          "function": "eventos",
          "line": 143,
          "methods": [
            "GET"
          ],
          "route": "/dashboard/eventos",
          "auth_required": false
        },
        {
          "function": "mapa",
          "line": 154,
          "methods": [
            "GET"
          ],
          "route": "/dashboard/mapa",
          "auth_required": false
        },
        {
          "function": "empleados",
          "line": 164,
          "methods": [
            "GET"
          ],
          "route": "/dashboard/empleados",
          "auth_required": false
        },
        {
          "function": "historial",
          "line": 175,
          "methods": [
            "GET"
          ],
          "route": "/dashboard/historial",
          "auth_required": false
        },
        {
          "function": "historial_pedidos",
          "line": 181,
          "methods": [
            "GET"
          ],
          "route": "/dashboard/historial-pedidos",
          "auth_required": false
        },
        {
          "function": "detalle_pedido",
          "line": 201,
          "methods": [
            "GET"
          ],
          "route": "/dashboard/pedido/<int:pedido_id>/detalle",
          "auth_required": false
        },
        {
          "function": "turnos",
          "line": 214,
          "methods": [
            "GET"
          ],
          "route": "/dashboard/turnos",